"speech","year"
"tonight we see another turn of the year we look ahead and we look back we look ahead with confidence and expectation and we look back did the year turn out the way we had hoped no the year 2020 brought us what nobody had imagined in february the coronavirus hit europe and in early march large sections of danish society had to go into lockdown the pandemic has changed all of society it has changed our everyday lives we have had to do a great many things differently avoid contact keep a distance stay at home work in other ways than we are used to we faced a disease which nobody knew and which we had no medicines against it was alarming and it proved necessary to carry through wide ranging restrictions on our daily lives crowded streets became deserted many not least elderly people had to do without their close contact with family and friends it was with great concern that we watched the numbers of people who were infected and hospitalised and the numbers of deaths which soon showed up it was serious we understood that it took its toll on everybody but forced by the serious circumstances new ideas emerged on how we could live with the crisis and get through it people met on the net they worked from home they went for a stroll in nature where it was possible and perhaps they experienced spring more keenly than ever before when summer approached the pressure eased we still could not go abroad but then we stayed at home we took walks through the green beech forest we went to the beach the fine danish beach we rediscovered or experienced perhaps for the first time how many wonderful and diverse places there are in denmark sometimes just round the corner i think that many have had an eye opening experience regarding our lovely nature and the calm it can give us in situations when we are under pressure the climate has benefited during the crisis this is worth paying attention to and it is important that we continue to take good care of nature in autumn the coronavirus returned more swiftly than expected and with renewed strength new restrictions were necessary but fortunately not so far reaching as we have seen in other places in europe where curfews have been imposed nevertheless companies have been forced into bankruptcy and many have lost their jobs through no fault of their own many have seen their life s work fall to the ground this has affected me very much the period we have been through has given us all food for thought what is it that really matters to us as a society as human beings what lessons have we learned and what can we take with us when we have lost something or have had to do without something we learn to appreciate what we have we have experienced how much our contact with other people means how important the close ties are to all of us and how essential trust is in each other and in the society we are all part of the crisis has led to changes both at personal and societal levels let us assure each other that on the other side of the crisis we will remember what we have been through let us take the good lessons learned with us and let us try to organise our lives in accordance with them we hope that things will soon move in the right direction but we have not reached that point yet and ahead of us lie a few more winter months we must continue to live with restrictions and it has not been much fun especially during christmas time however let us not lose heart let us continue to practice caution and consideration when socialising with others it is a source of joy and encouragement that the vaccine is now a reality and that vaccination has started tonight i bring a special thank you to the many who right from the beginning stood on the front line in the fight against corona they are the many healthcare professionals at hospitals who from day one did everything to combat the disease even before we had the full overview and knowledge of the danger facing us they did not count the hours or the days they relieved the suffering caused by covid 19 they researched exhaustively to understand the unknown disease i also send a deeply felt thank you to the many who from the outset have worked hard in the effort to test us and curb the spread of the virus i also wish to express my thanks to the staff at our many nursing homes and drop in centres who care for and brighten the lives of nursing home residents and drop in centre users who cannot keep up close contact with their next of kin also many children and young people have experienced a loneliness during the corona crisis they had hardly imagined not to be able to meet at school or in their spare time has proved a restriction which i believe did not become lighter as time went by especially when summer came and the infection rate slowed no doubt it has been frustrating not to be able to gather in large groups and to see one music festival after another being cancelled i understand that very well but we must see this through much has been cancelled during the corona crisis it has not been possible to hold weddings confirmations and special birthdays as planned nor could my own eightieth birthday be celebrated the way we had planned it but i have never been celebrated so overwhelmingly and so warmly as this year that birthday will remain the most memorable in my recollection i wish to thank you for that with all my heart this year we were to have celebrated the centenary of the reunification of south jutland with denmark like others i had looked forward to the days of commemoration in july but the corona epidemic made it impossible we will now look forward to the coming summer in the hope that we can meet then tonight my thoughts go to the danes in south schleswig also for people in south schleswig this has been a difficult year with a partially closed border i hope that the newyear will bring us back to the close contact we are used to and which is of so great importance on both sides of the border i send my warmest newyear greetings to everybody the corona epidemic has also impacted on life in greenland in the faroe islands thanks to a great effort and good understanding both societies have been able to limit the outbreak of the disease nevertheless the epidemic has been an expensive acquaintance the tourist industry which in recent years has come to mean more and more for both societies has almost ground to a halt leading to huge economic losses next summer it is my hope to be able to visit both the faroe islands and greenland once again i look forward to my revisit to the faroe islands the wonderful islands and the proud people in the north atlantic i look forward to witnessing the rapid development which faroese society has experienced since my latest visit in 2016 the year 2021 is the centenary of the first ever visit by a king to greenland when christian x and queen alexandrine together with their two grown sons my father crown prince frederik and prince knud sailed to nuuk then godthåb at the same time it is the tercentenary of hans egede s arrival in greenland a landmark year for both greenland and denmark i look forward to revisiting greenland and to once again meeting greenlanders both in nuuk and in many other places i hope that 2021 will be a good year i wish everybody in the faroe islands and greenland a happy newyear also this year many danes have been posted to various places throughout the world where there is unrest and conflict the efforts they make are noticed internationally they have also been affected by the corona crisis i send my thanks and my best newyear wishes to them and their relatives at home tonight my thoughts also go to everybody in the defence and the emergency management services they have experienced much restructuring and have had to take on new tasks but they have performed them responsibly and cheerfully i wish to thank them for that and i wish everybody a happy newyear i send my newyear wishes to the police with a thank you for their effort in the past year they have faced many challenges in addition to the usual ones it has not been easy but we have much to thank them for they contribute to ensuring that life in denmark can be safe and secure tonight my thoughts go the danes abroad and to the many with danish roots who feel a deep connection with denmark this year they must have felt more cut off from the old country than usual but i want them to know that they are in our minds i send my warmest newyear wishes wherever in the world they are i have just celebrated christmas with prince joachim and princess marie and the children it has been a joy being together again and seeing how well prince joachim has recovered from his disease last summer the many warm greetings and wishes that he has received have moved him and us all deeply i have also seen crown prince frederik and crown princess mary together with their children during the days of christmas they have had a busy year and their many tasks have had to be performed in untraditional ways it is a constant joy to see who well they do tonight we bid farewell to a strange year we will not forget 2020 this year has been a trial by fire but we have shown that when it comes to the crunch we can stand together and we manage to find moments of light in spite of deprivation and uncertainty we are now entering 2021 i hope the newyear will be a year that brings us many joys and where we continue to remember to be there for each other together with all my family i wish everybody a heartfelt happy newyear god bless you all god bless denmark",2020
"another year has gone by 2019 lies behind us now with all that it brought us memories that will endure good as well as sad ones and challenges we had to take on difficult as well as stimulating ones this year it is 50 years ago that man landed on the moon and we were able to see our own planet earth as a small globe in outer space quite alone but so beautiful and round and blue the blue planet where we belong for us here in denmark it is perhaps not so surprising that the planet is blue after all we have the sea in front of us and the blue sky above us regardless of how grand and varied it may seem our earth is vulnerable we are in the process of realising that and it gives rise to concern not least among many young people who see the climate change effects that are clearly visible these years we have a shared responsibility for our beautiful globe so teeming with life it is an essential challenge to us all today and it is important that we all pay attention to how we live and what actions we take in our age a feeling has emerged which may be difficult to talk about however we must put it into words in order to defeat it loneliness it is a feeling that many experience not only socially vulnerable people also elderly people who see their spouses or their contemporaries pass away what happened to them all those who used to fill everyday life but also children and very young people may experience loneliness who wants to play with me who can i talk to not just on facebook but in real life face to face in private with a friend of the same age or with someone who is older and who one can confide in someone to share one s thoughts with we need to talk together also about loneliness we need each other we need to have it confirmed that we matter 2020 will be a year with a great many things to remember on 9 april it is 80 years ago that denmark was occupied an event that came to influence all those who experienced it and which has left deep traces in the consciousness of denmark five years passed but then the liberation came on 4 and 5 may 1945 it filled everybody with euphoric joy which was also felt by those who like me were only five years old but not all could share in the joy for the island of bornholm was subjected to heavy bombardment that left the towns of rønne and nexø badly damaged and resulted in a tragic loss of civilian lives it is a long time ago and those who experienced the events of the time have almost all passed away nevertheless it is five years that continue to be remembered also with pride for the spirit of solidarity and self sacrifice that showed what we in denmark are capable of we must continue to stand guard over the values we fought for and which remain the foundation of our society it is disgraceful to see how anti semitism raises its ugly head once again also here in our country anti semitism intolerance and repression of people who think differently it has no place in our society this is something we must pay close attention to and which we must help each other to counter on 10 july we shall celebrate the centenary of the reunification of south jutland with denmark reunification day became a landmark day not just for the people of south jutland but a day that involved all the people of denmark in the thousands from all over the country people flocked south to see king christian x ride across the border on the white horse many may feel today that it is a distant event but ask the people of south jutland they know that a page was turned in the history of denmark on that day it will be fine for us to celebrate that when we reach the anniversary and we will celebrate it in late summer i visited schleswig holstein where i received a warm and festive welcome which contributed to confirming the strong neighbourly relations and good friendship between germany and denmark it also became an unforgettable meeting with the danish minority you did not come home to denmark 100 years ago however denmark is and will continue to be the country of your heart i was moved to hear that also from the young generation i shall never forget that it is thanks to both the danish minority in germany and the german minority in denmark that the border country has developed so harmoniously and peacefully over the years it has come to serve as a model for the rest of the world i send my warm newyear greetings to everybody in the border country while the ice around greenland is loosening its grip the world s attention is increasingly turning towards the country in the high north that country and its people are very close to me and the heart of my family we always follow events and developments in greenland and you are in our thoughts both when there are difficulties and when you address the problems with confidence i wish everybody in greenland a good and happy newyear my thoughts also go to the faroe islands on the last evening of the year also from there my family and i have warm and good memories with tireless persistence you have managed to overcome many of the difficulties facing a society that is geographically isolated and exposed to the forces of nature i send my heartfelt newyear wishes to everybody in the faroe islands under distant skies our danish soldiers who are posted abroad contribute to freedom and stability we must remember that on this evening when they are particularly missed at home i send my warmest greetings and good wishes for the newyear to all who are posted abroad and to their families it is not only in other countries that danes are on duty my newyear greetings go to everybody in the defence the emergency management services the police the health care sector and all others who are at work this evening and tonight men and women who all attend to their duties while others are off work and can celebrate newyear safely and securely wherever in the world one goes one will encounter danes in spring i visited argentina also in that country there are many who have danish roots and who hold on to this heritage to them and to all others with danish roots wherever in the world they are i send my newyear wishes with a thank you for their loyalty to the old country every day my big family makes me happy and proud the crown prince and the crown princess have plenty to do and at the same time they manage to create a warm home for their four children prince joachim and princess marie together with their two children are in paris where prince joachim is receiving additional training at the french military academy at the same time i have enjoyed watching his talks about danish history on tv i knew he would be good at it in the newyear prince christian s confirmation will take place he will soon be a young man with life ahead of him i shall celebrate my 80th birthday i have many years behind me i am grateful for all that the years bring me and for all the warmth that i and all my family continue to be met with it is a source of inspiration as well as an obligation we are standing at the door of the year 2020 we do not know yet what it will bring we open the door a little it is like making a new acquaintance with new opportunities we all have plans big and not so big plans and wishes more or less attainable wishes let us enter the newyear together i wish everybody a happy newyear may it become a good year for denmark god bless denmark",2019
"it is newyear s eve once again when the clock strikes twelve at midnight the old year comes to an end at that very moment we toast the newyear and wish each other happy newyear on newyear s morning we wake up to embrace new days they lie ahead of us waiting for us but the time that has passed lies behind us and yet all the things that happen to us leave an impact and provide us with experience good and not so good we must carry that experience with us further in life these years we are witnessing economic progress in denmark our companies feel it the danes feel it and are steaming ahead economically denmark is doing very well but we must also take the time to consider what this good fortune is doing for us and doing to us is economic progress also translated into social progress our country is becoming richer but are our lives becoming richer many people experience that the pace of day to day life has increased also more than all can keep up with there is so much that needs to be done both at work and during leisure time perhaps we create some of the demands ourselves we do not want to miss out on anything we want it all and preferably at the same time in our hurry we may become too keen on being in the limelight it is as if more people say look at me and fewer have an eye for others i fear that reflection and consideration may be pushed back and forgotten new technology has created altogether new opportunities for contact with others it is possible to facetime with one s children and grandchildren even though they are on the other side of the globe it is a source of great joy to all parties however new technology may also result in the contact becoming more impersonal we are online all the time and we forget that actually there is a human being at the other end it is so easy to write a comment or share a photo on social media that may be offensive and leave deep scars that sort of thing goes into cyberspace spreading like swarms of flies i find there is a tendency that our way of spending time together becomes more superficial less attentive we do not take the time to understand each other and we forget to respect each other and take care of each other it also affects our children there are probably some children who are also watching tonight to you i would like to say a few words the important thing is not how you look or what you have achieved but who you are and how you behave towards others your friends and schoolmates if you are so busy achieving what is best for yourself all the time you fail to see how others are doing you need to take the time to notice if a friend is unhappy there must be time to understand if you have said something that hurts a friend or you have teased someone too much it is important to patch things up again then this does not apply to children only we who are adults should also bear it in mind trust develops when we meet person to person and speak with each other we may well disagree we are entitled to that it is part of reflecting and forming an opinion but we must always listen to each other and try to understand each other this applies throughout our society our common strength is nurtured when we feel respect for our fellow human beings and place trust in each other for we all have a responsibility for the community this is the very roots of our society if the roots are not healthy the tree cannot stand and it will take many years for a new tree to grow tall and strong therefore it is serious if people who represent an important part of our society take their responsibility too lightly and fail to meet their obligations is this something we have seen recently those entrusted with high positions carry a special responsibility and a special duty to do their best where they are placed it makes me very sad if morals decline what is to become of common decency then we must be able to distinguish between what is yours and mine between right and wrong it ought not to be that difficult it is a matter of concern to more and more people that our lifestyle affects the environment and climate change companies have green strategies wind sun and biomass provide us with cleaner energy at home in the kitchen we sort waste many buy organic products it is probably the young who are leading the way they understand that the problems of the future will become theirs they unlike us older people do not want to get stuck in old habits therefore we must listen attentively to the young when we discuss how to avoid challenging the balance of nature we must give consideration to the future we must give the future careful thought in time in greenland the ice is melting there the changes are also conspicuous there in the high north people live close to nature wind and weather snow and ice are something all are dependent on throughout the year these years nature is generous the fishing industry is doing well that generates progress it is my hope that the good development in greenland will continue and that this vast country will become better integrated and more closely linked to denmark and the world at large i send my warmest newyear greetings to everybody in greenland this summer the crown prince and the crown princess together with their four children visited the faroe islands they encountered a modern society with high growth and development but also a people that is aware of who they themselves are faroese people are characterised by a directness hospitality and warmth that i remember from the visits prince henrik and i paid to the country tonight i wish to say a big thank you to everybody who contributed to making the visit to the faroe islands a unique experience for the crown prince the crown princess and their children i wish everybody in the faroe islands a happy newyear i send special newyear greetings to the danish minority in south schleswig there danish culture and language live in peaceful co existence with the german majority in a world where so many border regions are characterised by conflicts of interest and sharp viewpoints exactly this region serves as a fine example which both danish and german institutions and associations can be proud of tonight my thoughts also go to the danish soldiers police officers and specialists who are posted abroad there are not so many this year but they matter each and every one of them in the places where they serve in countries like iraq afghanistan kosovo and the baltic states they are missed at home we think of them and wish them a happy newyear i also send my newyear greetings to all danes who live outside denmark regardless of whether they are staying abroad for a short while or have settled perhaps for good they contribute to representing denmark it is far from all who are off duty tonight here in denmark the emergency management agency the police the defence and the fire brigade are on duty they see to it that the rest of us can celebrate the newyear safely and securely on buses and in taxis on trains and planes and on board ships it is not possible to be off duty on such a newyear s eve also many are on duty at hospitals nursing homes and other institutions where they make sure that newyear s eve is safe and festive many volunteers choose to hold the newyear celebrations at hostels and other shelters where they turn up to make the evening festive for those who are most alone and find life hard i send newyear greetings to the many who are working for us all tonight i cannot look back at the year that has passed without mentioning the death of prince henrik we spent 50 years together we had two sons and eight grandchildren have been added to the family we were given all that and much more the warm sympathy shown us and the understanding of prince henrik s contribution which was so beautifully expressed by everybody in denmark upon his demise have warmed the hearts of us all including his family in france once again i wish to express my deep felt gratitude crown prince frederik celebrated his 50th birthday this year he decided to celebrate it in quite his own way a big thank you to the many thousands both grown ups and children who participated in the royal run either by running the route or like myself by cheering on the runners it was a fine day that made him both happy and grateful and which made me so proud the crown prince the crown princess prince joachim and princess marie and my eight wonderful grandchildren together with me have so much to say thanks for we all feel the warm support which we encounter everywhere on special occasions as well as in day to day life life brings us both sorrows and joys let us welcome the newyear with reflection and consideration let us carry our experience good and not so good into the newyear and let us embrace the year in a spirit of hope and confidence i wish you all a happy newyear god bless denmark",2018
