"speech","year"
"for most of us the holidays around christmas and newyear are a wonderful time of the year they are festive days when we meet with family and friends relax and enjoy ourselves and take a break from everyday worries while it is cold and dark outside with the wind sweeping around the corners of the house we are warm and comfortable with lit candles and together with people we care for we take the time to enjoy each other s company something we forget far too easily in our day to day lives great expectations are linked to holidays and festive occasions also to the newyear s celebrations tonight we have done the shopping and decorated our homes and we make a great effort to ensure that neither children nor grown ups get disappointed perhaps it is our great expectations that also cause tensions to rise during the holidays in many families christmas and newyear are something of a puzzle to be worked out we must be fair who spent christmas with whom last year who is going to be where this year it is not always easy to please everybody fortunately the problems are most often solved in a friendly manner but tensions may arise that are so serious that they cast a shadow over the family reunion however there are people who would gladly exchange their own problems for those i have just described those who find christmas and newyear particularly difficult to cope with are people who have no family at all to argue with over these matters or whose family suffers from much heavier problems that overshadow their joy tonight i want to send my warmest newyear greetings to all those who are struggling with illness or loneliness with misuse or homelessness i also wish to extend my greetings to the many that spend the holidays helping those people who are most in need they have experienced how much it may mean to us personally when we contribute to the happiness of others their efforts are invaluable and they deserve recognition and gratitude from us all denmark is a country with many different people we are young or old or somewhere in between some live in the countryside some in towns some have lived here all their lives others have arrived not so long ago but we are part of the same community and that is why we share conditions in all matters large and small for better or for worse we must distinguish between large and small problems it is true that denmark is a small country but we must take care not to become a small minded country and if we bear that in mind we will understand that we must solve our problems by bending towards each other if one branch alone has to bend it may break we must not put a lid on discussions we must dare take the necessary debates it may be at our workplace at school or where we live that is a good beginning the next step is for us to listen to what others say then we may have a discussion to make us wiser it requires courage to enter into a debate but also to show generosity of spirit our modern lives give us many advantages that we would not want to do without we enjoy a degree of freedom and prosperity unknown to previous generations but development comes at a price it is as if personal contact is being lost in our busy and preoccupied lives today all those modern facilities meant to make life easier also make it more complicated and make increasing demands on us for what we are to achieve and perform we are concerned about future climate change and so we should be but sometimes we forget to enjoy a lovely day the sun and the wind and the changing seasons we are concerned about problems on the other side of the world and of course this is important but do we have the awareness to help the family next door who we know may need it we worry over today s problems both for ourselves and for the world at large let us nevertheless take a look at the past let us remember a period of time that was truly critical for our country and our society 70 years ago during the jewish newyear in october danish jews had to flee in the middle of their newyear celebrations otherwise quite normal workdays they had to break up and flee in all haste all of a sudden families children and old people found themselves in a terrible crisis they were forced to make their escape across the waters of the øresund in small fishing vessels hidden away in damp and confined holds with the fear of death as their travelling companion these are experiences which have never been forgotten and which make a strong impression also on all of us that have only been told about them but what happened then is also something we can take pride in remembering and we must continue to cherish the memory of it it was then that denmark showed its strength as a community as men and women from all walks of life individually and spontaneously looked for solutions organising escape routes providing food and shelter without consideration for their own safety today danes are still individuals with varying outlooks we are not all of us rooted in the same religion or culture however as was the case 70 years ago differences must not be allowed to prevent us from helping our neighbours and fellow countrymen from person to person the danish realm of today comprises different peoples with different cultures and with their separate languages this we recognise and respect but we are also bound together through our long history and we must stand guard over all that we have in common and that unites us as the ice off greenland starts to melt new prospects open for shipping routes in waters never navigable before at the same time new opportunities appear for tapping into the rich resources of that country to the benefit of both employment and revenue but this development also implies a huge responsibility for all who become involved this applies to maritime safety as well as to the vulnerable natural environment of greenland faroese society has already experienced part of the development which greenland society is now facing but as is the case for greenland the faroe islands are constantly dependent on natural resources and the international community s market conditions of this they are fully aware i am convinced that the faroe islands also in future will be able to demonstrate the resilience and innovativeness required to navigate under the given conditions we all feel the strongly increased international interest in the north atlantic area this interest faces both greenland and the faroe islands with decisions of far reaching significance and it will have implications for each individual society as well as for the danish realm as such i wish to send my warmest newyear wishes and greetings to everybody in greenland and to everybody in the faroe islands it is with great pleasure that i think of the many times my family and i have visited these parts of the realm that are so very close to our hearts and it is with much gratitude that i think of the warm hospitality which we always enjoy also the danes in south schleswig are linked to denmark with strong ties of the heart i am always very happy to see that so many hold on to danish culture and tradition and i wish to extend my hopes for a happy newyear to the many associations and institutions and to all danish homes this year again there are danish soldiers and other personnel posted to dangerous parts of the world we all wish to see them returning safe and sound i wish to thank all of them for their contribution both the crown prince and prince joachim have visited them in kosovo as well as in afghanistan they are like me deeply impressed with their contributions although the danish presence will be gradually reduced in 2014 it does not close the chapter for them all some must live on with both physical and mental wounds let us not forget them i wish every single person at home and abroad a happy newyear on newyear s eve many danes throughout the world follow newyear s celebrations in denmark i wish each and everyone across all time zones a happy newyear to everybody who must be on duty tonight to ensure that our society remains safe and secure i also send my best newyear s greetings and my gratitude for their work in the course of the year last but not least i wish to thank you for the year that has passed this comes from the prince consort and myself as well as from our entire family we thank you for all your kind attention and for the many heart warming meetings and greetings we have received throughout this year the year 2013 is drawing to an end what the newyear may bring none of us knows but let us step into it together in a spirit of hope and confidence i wish each and every one of you a happy newyear 2014",2013
"it is newyear s eve in a few hours the copenhagen town hall bells will toll the newyear 2013 is here of this we can be certain and we look forward to it in hope and anticipation but we cannot predict what it will bring us our society or denmark we try to predict we make estimates we do our best not to be taken by surprise by the course of events the newyear will always be unknown territory therefore it is not only a matter of what will happen but a question of how we cope with it we danes have always regarded ourselves as hard working and enterprising the danish society did not evolve of itself our society is a result of the efforts we have made through the ages to shape the future and to ensure progress capable tradesmen have been selling danish goods to foreign countries fearless seamen have sailed all over the world persistent farmers have reclaimed the moors of jutland industrious workers and craftsmen have played their part for denmark to become what it is today that is how we have jointly developed our society and that is how we would like it to continue in times of crisis difficulties may seem enormous and obstacles insurmountable impossible to overcome therefore the outlook for tomorrow may seem grim for those on the sidelines if one is left out while the wheels are turning and one is unemployed or in fear of becoming so today our society contributes greatly to solving these problems we must be careful however not always to leave everything to society alone to straighten things out we must begin with ourselves with those close to us and with those we encounter along the way each one of us can help so much with an encouraging remark a helping hand respect and consideration for the other person it has always been one of our strengths here in denmark that we know each other inside and out and that even our geographical distances are short the crisis in which our world finds itself today and which is also felt in denmark should call for all our creativity and enterprise to the benefit of everyone and to all for the future of our country in difficult times we should not only be aware of outside factors we should also keep in mind how we personally react to each other and to ourselves the current tendency is to imagine the perfect life with spouse children an inspiring job exciting hobbies and a youthful appearance irrespective of age who could hope to live up to all that why should we sooner or later we may all come up against hardship we shall all break our necks in a crisis if only the perfect and superficial life is good enough to me it seems that young people especially are vulnerable the modern means of communication like the internet and facebook offers fantastic opportunities but can be dangerous too the very young can so easily become addicted that they practically live in cyberspace so that life is lived in a parallel universe in a display window in which appearances are more important than essence but the young generation must strive to be themselves not only as a group but also as individuals it is our duty to help them along not by paving their way but by instilling them with confidence so that they can manage their own lives tomorrow on january 1st it is 40 years ago that denmark joined the european union the european union was established on the grounds of a europe in ruins after the second world war it was created to recognize the need for rebuilding and cooperation across the borders through our entry we manifested our already existing conditions both economically and geographically that we are a part of the continent of europe that our culture our history our everyday life are influenced by our being a part of europe it was a big step for us and it did not come about without being questioned but it remains a fact that our continent via the european union has enjoyed a blossoming which everybody has benefited from and that we have experienced increasing peace after centuries of war unrest and mutual distrust we must cherish these benefits during the autumn it was a pleasure for me to make a short visit to greenland on the occasion of the merging of the island command faroes and the island command greenland into the new arctic command with headquarters in nuuk the new command is testament to our response to the new challenges and possibilities brought about by the developments in the arctic greenland especially is facing decisions of great importance to the development of its society this is something we must all be aware of in the north and in the south certainly thousands of miles lie between denmark greenland and the faroe islands but in the unity of the realm our mutual connection and common history manifest themselves my family and i have always felt a strong connection to both greenland and the faroe islands with these words i send my warmest newyear wishes and greetings to everyone in greenland and to everyone in the faroe islands i also send my warm newyear greeting to the danish minority in south schleswig here the danish spirit lives on it is deeply rooted in old traditions but clearly visible also in our time the fact that this danish spirit is permitted to blossom south of the border i see as a sign of friendship respect and good neighbourliness between danes and germans i extend my greeting and good wishes to everyone celebrating newyear far from denmark my greeting goes especially to our soldiers and other deployed personnel in dangerous outposts their great and brave contribution does denmark credit i wish them and their families a happy newyear may they all come home safely tonight my thoughts also go out to our veterans and their families to some of them their deployment is not a finished chapter because they and their families must battle with the consequences of what they have been through may the newyear bring them renewed courage and may we all take part in securing their future also a society like ours would not function if it were not for those who even on newyear s eve stay at their posts to ensure safety for us all i wish each and every one of them a happy newyear and thank them for their efforts on newyear s eve it is customary to gather friends and family and to reminisce about the year that has passed and what it brought us often we sorely miss people who are dear to us perhaps because they are far away but sometimes one or more are missed because we shall never be with them again my newyear thoughts go to anybody who is left with that sorrow and that loss to me the year 2012 has in many ways been signified by the 40 year jubilee on the last evening of the year i would like to offer my thanks for all the kindness shown to me throughout the year so to speak every single day it has delighted me and warmed me more than i can say throughout the year my family has felt surrounded by warm attention and sympathy this came to the fore not the least when prince joachim s and princess marie s little daughter was born in january and at her christening later in the year i wish everyone a happy and blessed newyear god bless denmark",2012
"on newyear s eve it is customary to look back at the year that has passed personally i cannot do that without first and foremost saying thank you when i think of all the kindness and attention i have received over the year especially in connection with my 70th birthday in april that day has added light and joy to the entire year which has touched and moved me much more than i can say it was not just here in copenhagen on the day itself but i also experienced it throughout the country wherever i came alone or together with my family and it also characterised our visit to the faroe islands even though we all may find much to take pleasure in over the past year it has nevertheless been a year characterised by the economic crisis that has affected the world community and consequently also danish society there is reason for concern because many have lost their jobs shops earn less money when the customers have less money to spend and the global scale of the crisis means that companies sales decrease both at home and abroad nevertheless denmark is one of the nations that have been less severely affected by the crisis during the crisis we have benefited from the fact that in denmark we have experienced prosperity and we have had savings to draw on but what we can draw on is not only our solid material wealth we are also wealthy in other ways we have an established community which we take pride in it goes very far back in our history back to the free constitution indeed it goes even further back in history because the constitution of 1849 may be perceived as confirmation of a community that already existed the community is a strong quality which we should appreciate and which we need when times are not so good together we must draw on our ingenuity our diligence and creative powers these are characteristics we can draw on as we are now endeavouring to wrench ourselves out of the grips of the crisis when we see how others become increasingly skilful we must not let ourselves be daunted by it but let it be a spur to us we must not content ourselves with what we once excelled at but continue to use the combination of individualism and unity that has brought us this far denmark has known many crises and difficult times throughout history but together we have survived them and everybody has contributed but are we seeing indications these years that we have become more selfish that we have become inclined to first and foremost make demands and make sure that we all get what we ourselves think we are entitled to are we becoming distrustful of each other and beginning to ascribe less than pure motives to each other if that is the case we are not only in an economic crisis then it is our attitudes that are slipping it is a crisis that is insidious because it creeps upon us and poisons our relationships with each other it means that we are jeopardising something that may be irretrievable a crisis that is measurable and quantifiable so to speak a crisis that lends itself to figures and graphs is not nearly as serious as a crisis of values and attitudes that are faltering we will find a way out of the present economic crisis in the short or the long term but we must find a way out of it with our decency intact and without jeopardising our community in the course of the last few generations society has developed in such a way that we can live more and more safely both financially and socially we have got used to being able to pick and choose quite freely in big and small matters our circumstances are so good now that we have almost forgotten that our decisions also have consequences and that we cannot opt into or out of all life s conditions as human beings we are mutually dependent on each other it is true today as it was yesterday and at all times previously it was perhaps more obvious when people lived in small village communities where many tasks had to be performed jointly and where several generations often lived under the same roof and all had their tasks to perform for each other it was a relationship of interdependence that was obvious to everybody today we have left it to society to deal with many of the obligations that were once each individual s task often it goes so far that we completely forget or overlook the fact that our society is actually all of us and that it cannot work at all if we do not each of us make an effort and feel a commitment to our loved ones as well as to those we do not come across on a daily basis we have achieved a freedom to shape our own lives to an extent that former generations never knew and we should appreciate it but we should also remember that no one is self sufficient therefore we must take care of this society which we know as a safe framework for the individual s activities and we must keep eyes and ears and hearts open to our fellow men on the last evening of the year when so many gather with family members and friends we should not forget those who must celebrate the newyear far from denmark my thoughts go in particular to our soldiers in afghanistan they are on a mission that is extremely difficult and dangerous but they perform it in a targeted and conscientious manner and with great courage both they and their relatives at home will be in our thoughts tonight sitting at home alone can be hard when the person one loves is far way in dangerous surroundings i know from the crown prince who visited our soldiers just before christmas that they approach their tasks in a spirit of seriousness and confidence and they know that they can carry them out nevertheless the price of our effort in afghanistan has been high several young danes have lost their lives also this year let us remember them tonight and think of their relatives friends and fellow soldiers who are now left with a great sense of loss some of our soldiers have returned badly wounded and others are mentally scarred by their experiences it applies to all of them that they deserve all our care and recognition in the autumn i had the opportunity to meet some of our wounded soldiers undergoing rehabilitation at the copenhagen university hospital they all show a love of life and an incredible determination to overcome their disabilities which made a great impression on me and which can only command admiration i send my newyear greetings to all danish men and women working for our security and safety in the armed forces the emergency management and the police happy newyear to all of you at home and abroad wherever you are as always at newyear my thoughts go to the danes who live south of the border they are part of our danish community that tie has never been severed we are proud of that every year it is a great pleasure for the prince consort and me to visit various parts of the country this year we also visited the faroe islands and we are planning a visit to greenland on board the dannebrog in the summer we are looking very much forward to that and when i send my newyear greetings to the faroe islands and greenland here tonight i also wish to say thank you for the confidence shown me and my family both in greenland and in the faroe islands and for the warm ties which i feel bind us together 2010 has been a good year with many joys for my family and me we are now looking forward to the newyear with great expectations especially to the addition to the family which is going to take place in january it is a great source of joy and happiness to us all to feel the warm interest we encounter wherever we go in good times we must remember that good fortune is not a matter of course and that there are always some for whom everyday life is hard in difficult times we must not lose heart and a smile helps us get through the days when life seems dreary so let us face the newyear with confidence and let us trust each other in big and small matters this will be my wish for the year 2011 god save denmark",2010
